<?xml version="1.0" encoding="UTF-8"?>
<tns:tax_list xmlns:tns="http://www.example.com/MobileTaxes"
              xmlns:xsi="http://www.w3.org/2001/XMLSchema-instance"
              xsi:schemaLocation="http://www.example.com/MobileTaxes  TaxesTemplate.xsd">
    <name>
        <operator_name>Life</operator_name>
        <payroll>12</payroll>
        <call_price>
            <in_network>0</in_network>
            <out_network>0.3</out_network>
            <office_stations>0.6</office_stations>
        </call_price>
        <sms_price>0.4</sms_price>
        <params>
            <number>0639395945</number>
            <taxification>minute</taxification>
            <conn_tax>0</conn_tax>
        </params>
    </name>
    <name>
        <operator_name>Kuchmastar</operator_name>
        <payroll>15</payroll>
        <call_price>
            <in_network>0</in_network>
            <out_network>0.4</out_network>
            <office_stations>0.55</office_stations>
        </call_price>
        <sms_price>0.6</sms_price>
        <params>
            <number>0674515945</number>
            <taxification>12sec</taxification>
            <conn_tax>0.3</conn_tax>
        </params>
    </name>
    <name>
        <operator_name>Vatafone</operator_name>
        <payroll>30</payroll>
        <call_price>
            <in_network>0.1</in_network>
            <out_network>0.5</out_network>
            <office_stations>0.8</office_stations>
        </call_price>
        <sms_price>0.5</sms_price>
        <params>
            <number>0939395945</number>
            <taxification>12sec</taxification>
            <conn_tax>0.4</conn_tax>
        </params>
    </name>
</tns:tax_list>
